_query_time,_type,_id,_session,_status,_short_title,_official_title,_passed_house,_passed_senate,_introduced,_top_subject,_sponsor_id,_sponsor_name,_sponsor_party,_n_cosponsors,_n_dem_cosponsors,_n_rep_cosponsors,_n_withdrawn_cosponsors
2021-02-26_00-54-48,hr,2252,116,PARSED,Integrity in Testing for Lead in Military Housing Act of 2019,To direct the Secretary of Defense to establish a policy relating to lead testing on military installations.,False,False,2019-04-10,Armed Forces and National Security,K000380,Dan Kildee,D,3,3,0,0
2021-02-26_00-54-48,hr,2253,116,PARSED,"To prohibit the Secretary concerned from discouraging the inspection of military housing for lead-based paint or other sources of lead, and for other purposes.","To prohibit the Secretary concerned from discouraging the inspection of military housing for lead-based paint or other sources of lead, and for other purposes.",False,False,2019-04-10,Armed Forces and National Security,K000380,Dan Kildee,D,4,4,0,0
2021-02-26_00-54-49,hr,2254,116,PARSED,"To amend titles 10 and 37, United States Code, to ensure that children covered by the TRICARE program are screened and tested for lead levels, and for other purposes.","To amend titles 10 and 37, United States Code, to ensure that children covered by the TRICARE program are screened and tested for lead levels, and for other purposes.",False,False,2019-04-10,Armed Forces and National Security,K000380,Dan Kildee,D,3,3,0,0
2021-02-26_00-54-49,hr,2255,116,PARSED,To direct the Secretaries of the military departments to submit certification and a report each year to the Secretaries of Defense and Housing and Urban Development regarding whether housing under the jurisdiction of the Secretaries of the military depart,To direct the Secretaries of the military departments to submit certification and a report each year to the Secretaries of Defense and Housing and Urban Development regarding whether housing under the jurisdiction of the Secretaries of the military departments is in compliance with requirements relating to lead-based paint.,False,False,2019-04-10,Armed Forces and National Security,K000380,Dan Kildee,D,3,3,0,0
2021-02-26_00-54-50,hr,2256,116,PARSED,Driving America Forward Act,"To amend the Internal Revenue Code of 1986 to modify limitations on the credit for plug-in electric drive motor vehicles, and for other purposes.",False,False,2019-04-10,Taxation,K000380,Dan Kildee,D,140,140,0,0
2021-02-26_00-54-53,hr,2257,116,PARSED,"To require lead testing in Department of Defense Education Activity schools, and for other purposes.","To require lead testing in Department of Defense Education Activity schools, and for other purposes.",False,False,2019-04-10,Armed Forces and National Security,K000380,Dan Kildee,D,4,4,0,0
2021-02-26_00-54-54,hr,2258,116,PARSED,Promotion and Expansion of Private Employee Ownership Act of 2019,"To amend the Internal Revenue Code of 1986 and the Small Business Act to expand the availability of employee stock ownership plans in S corporations, and for other purposes.",False,False,2019-04-10,Taxation,K000188,Ron Kind,D,52,26,27,0
2021-02-26_00-54-55,hr,2259,116,PARSED,Truth in Employment Act of 2019,To amend the National Labor Relations Act to clarify employer rights with regard to hiring.,False,False,2019-04-10,Labor and Employment,K000362,Steve King,R,0,0,0,0
2021-02-26_00-54-56,hr,2260,116,PARSED,E-bonding for Immigration Integrity Act of 2019,"To require the Secretary of Homeland Security to impose e-bonding requirements on certain nonimmigrant visa applicants, and for other purposes.",False,False,2019-04-10,Immigration,K000362,Steve King,R,3,0,3,0
2021-02-26_00-54-56,hr,2261,116,PARSED,Customs Business Fairness Act of 2019,"To amend title 11 of the United States Code, to allow full subrogation, including subrogation to the priority rights of the United States, of claims for the payment of customs duties.",False,False,2019-04-10,Finance and Financial Sector,K000210,Peter T. King,R,26,20,6,0
2021-02-26_00-54-57,hr,2262,116,PARSED,Environmental Health Workforce Act of 2019,To prioritize educating and training for existing and new environmental health professionals.,False,False,2019-04-10,Health,L000581,Brenda Lawrence,D,29,29,0,0
2021-02-26_00-54-58,hr,2263,116,PARSED,Make Education Local Act of 2019,To allow a State to submit a State management decision to the Secretary of Education to combine certain funds to improve the academic achievement of students.,False,False,2019-04-10,Education,L000589,Debbie Lesko,R,3,0,3,0
2021-02-26_00-54-58,hr,2264,116,PARSED,Bear Protection Act of 2019,"To conserve global bear populations by prohibiting the importation, exportation, and interstate trade of bear viscera and items, products, or substances containing, or labeled or advertised as containing, bear viscera, and for other purposes.",False,False,2019-04-10,Foreign Trade and International Finance,L000582,Ted Lieu,D,38,32,6,0
2021-02-26_00-54-59,hr,2265,116,PARSED,Relocation Expense Parity Act,"To enhance the ability of Federal agencies to deliver relocation management services to the Federal Government, and for other purposes.",False,False,2019-04-10,Government Operations and Politics,L000591,Elaine Luria,D,0,0,0,0
2021-02-26_00-55-00,hr,2266,116,PARSED,Child Tax Credit for Pregnant Moms Act of 2019,To amend the Internal Revenue Code of 1986 to provide a child tax credit for pregnant moms with respect to their unborn children.,False,False,2019-04-10,Taxation,M001187,Mark Meadows,R,23,0,23,0
2021-02-26_00-55-01,hr,2267,116,PARSED,Infant Formula Protection Act of 2019,"To amend the Federal Food, Drug, and Cosmetic Act to treat infant formula as adulterated if its use by date has passed.",False,False,2019-04-10,Health,M001188,Grace Meng,D,1,1,0,0
2021-02-26_00-55-01,hr,2268,116,PARSED,Menstrual Products Right To Know Act of 2019,"To amend the Federal Food, Drug, and Cosmetic Act to treat certain menstrual products as misbranded if their labeling does not list each ingredient or component of the product, and for other purposes.",False,False,2019-04-10,Health,M001188,Grace Meng,D,19,19,0,0
2021-02-26_00-55-02,hr,2269,116,PARSED,Get Additives Out Act of 2019,To require the Comptroller General of the United States to conduct a study and submit a report on the effects of food additives on children's health.,False,False,2019-04-10,Health,M001188,Grace Meng,D,0,0,0,0
2021-02-26_00-55-03,hr,2270,116,PARSED,Removing Barriers to Foster Youth Success in College Act,"To amend the Higher Education Act of 1965 to require assurances by recipients of assistance under section 402B or 402C of that Act with respect to activities for homeless children and youths and foster care children and youth, and for other purposes.",False,False,2019-04-10,Education,M001201,Paul Mitchell,R,4,3,1,0
2021-02-26_00-55-03,hr,2271,116,PARSED,Scarlett's Sunshine on Sudden Unexpected Death Act,To amend the Public Health Service Act to improve the health of children and help better understand and enhance awareness about unexpected sudden death in early life.,True,False,2019-04-10,Health,M001160,Gwen Moore,D,73,63,10,0
2021-02-26_00-55-05,hr,2272,116,PARSED,Tax Equity Act of 2019,To amend the Internal Revenue Code of 1986 to provide for adjustments in the individual income tax rates to reflect regional differences in the cost-of-living.,False,False,2019-04-10,Taxation,N000002,Jerrold Nadler,D,2,2,0,0
2021-02-26_00-55-05,hr,2273,116,PARSED,Tax Fairness for All Families Act of 2019,To amend the Internal Revenue Code of 1986 to provide an increasingly larger earned income credit for families with more than 3 children.,False,False,2019-04-10,Taxation,N000002,Jerrold Nadler,D,0,0,0,0
2021-02-26_00-55-06,hr,2274,116,PARSED,Veterans Conservation Corps Act of 2019,"To require the Secretary of Veterans Affairs to establish a veterans conservation corps, and for other purposes.",False,False,2019-04-10,Armed Forces and National Security,N000191,Joe Neguse,D,1,1,0,0
2021-02-26_00-55-06,hr,2275,116,PARSED,District of Columbia Local Juror Non-Discrimination Act of 2019,"To amend title 11, District of Columbia Official Code, to prohibit the exclusion of individuals from service on a District of Columbia jury on account of sexual orientation or gender identity.",False,False,2019-04-10,Government Operations and Politics,N000147,Eleanor Holmes Norton,D,45,43,2,0
2021-02-26_00-55-07,hr,2276,116,PARSED,Fair and Equal Treatment of Women in the Coast Guard Act,"To amend title 14, United States Code, to direct the Coast Guard to submit a report to Congress on efforts to increase gender diversity, and for other purposes.",False,False,2019-04-10,Transportation and Public Works,P000614,Chris Pappas,D,1,0,1,0
2021-02-26_00-55-08,hr,2277,116,PARSED,"To designate the facility of the United States Postal Service located at 1715 Linnerud Drive in Sun Prairie, Wisconsin, as the ""Fire Captain Cory Barr Post Office Building"".","To designate the facility of the United States Postal Service located at 1715 Linnerud Drive in Sun Prairie, Wisconsin, as the ""Fire Captain Cory Barr Post Office Building"".",False,False,2019-04-10,Government Operations and Politics,P000607,Mark Pocan,D,7,2,5,0
2021-02-26_00-55-09,hr,2278,116,PARSED,RAISE Act,"To amend the Immigration and Nationality Act to establish a skills-based immigration points system, to focus family-sponsored immigration on spouses and minor children, to eliminate the Diversity Visa Program, to set a limit on the number of refugees admitted annually to the United States, and for other purposes.",False,False,2019-04-10,Immigration,R000607,Francis Rooney,R,10,0,10,0
2021-02-26_00-55-09,hr,2279,116,PARSED,Safe Step Act,"To amend the Employee Retirement Income Security Act of 1974 to require a group health plan (or health insurance coverage offered in connection with such a plan) to provide an exceptions process for any medication step therapy protocol, and for other purposes.",False,False,2019-04-10,Health,R000599,Raul Ruiz,D,157,105,52,0
2021-02-26_00-55-09,hr,2280,116,PARSED,Stop Iran From Smuggling Weapons to Terrorists Act,"To authorize assistance and training to increase maritime security and domain awareness of foreign countries bordering the Persian Gulf, the Arabian Sea, or the Mediterranean Sea in order to deter and counter illicit smuggling and related maritime activity by Iran, including illicit Iranian weapons shipments.",False,False,2019-04-10,International Affairs,R000599,Raul Ruiz,D,0,0,0,0
2021-02-26_00-55-10,hr,2281,116,PARSED,Easy MAT for Opioid Addiction Act,To direct the Attorney General to amend certain regulations so that practitioners may administer not more than 3 days' medication to a person at one time when administering narcotic drugs for the purpose of relieving acute withdrawal symptoms.,True,False,2019-04-10,Health,R000599,Raul Ruiz,D,1,0,1,0
2021-02-26_00-55-10,hr,2282,116,PARSED,Medicare Care Coordination Improvement Act of 2019,"To amend title XVIII of the Social Security Act to modernize the physician self-referral prohibitions to promote care coordination in the merit-based incentive payment system and to facilitate physician practice participation in alternative payment models under the Medicare program, and for other purposes.",False,False,2019-04-10,Health,R000599,Raul Ruiz,D,12,5,7,0
2021-02-26_00-55-11,hr,2283,116,PARSED,CHANGE Act of 2019,"To provide better care and outcomes for Americans living with Alzheimer's disease and related dementias and their caregivers while accelerating progress toward prevention strategies, disease modifying treatments, and, ultimately, a cure.",False,False,2019-04-10,Health,S001156,Linda T. Sánchez,D,47,36,11,0
2021-02-26_00-55-12,hr,2284,116,PARSED,Disaster Tax Relief Act of 2019,To provide disaster tax relief for certain disasters occurring in 2019.,False,False,2019-04-10,Taxation,S001172,Adrian Smith,R,6,3,3,0
2021-02-26_00-55-12,hr,2285,116,PARSED,Heidi’s Law,To require the Secretary of Health and Human Services to revise the Mandatory Guidelines for Federal Workplace Drug Testing Programs to include testing for methadone use and to require the Secretary of Transportation to issue regulations to include testing for methadone use in Department of Transportation drug tests.,False,False,2019-04-10,Transportation and Public Works,S000522,Christopher H. Smith,R,0,0,0,0
2021-02-26_00-55-13,hr,2286,116,PARSED,"To amend the National Security Act of 1947 to direct the Director of the Federal Bureau of Investigation to provide to the congressional intelligence committees briefings regarding counterintelligence activities of the Bureau, and for other purposes.","To amend the National Security Act of 1947 to direct the Director of the Federal Bureau of Investigation to provide to the congressional intelligence committees briefings regarding counterintelligence activities of the Bureau, and for other purposes.",False,False,2019-04-10,Armed Forces and National Security,S001196,Elise Stefanik,R,8,0,8,0
2021-02-26_00-55-13,hr,2287,116,PARSED,Federal Regulatory Certainty for Water Act,"To clarify the definition of navigable waters, and for other purposes.",False,False,2019-04-10,Environmental Protection,T000238,William M. Thornberry,R,0,0,0,0
2021-02-26_00-55-14,hr,2288,116,PARSED,Erie Canalway National Heritage Corridor Reauthorization Act,To increase the total authorization of appropriations for the Erie Canalway National Heritage Corridor.,False,False,2019-04-10,Public Lands and Natural Resources,T000469,Paul Tonko,D,18,15,3,0
2021-02-26_00-55-15,hr,2289,116,PARSED,Notario Victim Relief Act,"To amend section 240(c)(7)(C) of the Immigration and Nationality Act to eliminate the time limit on the filing of a motion to reopen a removal proceeding if the basis of the motion is fraud, negligence, misrepresentation, or extortion by, or the attempted, promised, or actual practice of law without authorization on the part of, a representative.",False,False,2019-04-10,Immigration,V000131,Marc Veasey,D,18,18,0,0
2021-02-26_00-55-16,hr,2290,116,PARSED,Shutdown Guidance for Financial Institutions Act,"To require the Federal financial regulators to issue guidance encouraging financial institutions to work with consumers and businesses affected by a Federal Government shutdown, and for other purposes.",True,False,2019-04-10,Finance and Financial Sector,W000825,Jennifer Wexton,D,0,0,0,0
2021-02-26_00-55-16,hr,2291,116,PARSED,Wild Game Donation Act of 2019,To amend the Internal Revenue Code of 1986 to provide tax incentives for the donation of wild game meat.,False,False,2019-04-10,Taxation,Y000033,Don Young,R,11,3,8,0
2021-02-26_00-55-17,hr,2292,116,PARSED,ACA OUTREACH Act,To amend the Patient Protection and Affordable Care Act to provide funding for American Health Benefit Exchanges navigator programs and outreach and promotional activities.,False,False,2019-04-12,Health,W000187,Maxine Waters,D,28,28,0,0
2021-02-26_00-55-18,hr,2293,116,PARSED,Protecting Access to Wheelchairs Act,"To amend title XVIII of the Social Security Act to exclude complex rehabilitative manual wheelchairs from the Medicare competitive acquisition program, and for other purposes.",False,False,2019-04-12,Health,L000557,John B. Larson,D,87,51,36,0
2021-02-26_00-55-20,hr,2294,116,PARSED,Association Health Plans Act of 2019,"To amend the Employee Retirement Income Security Act of 1974 to establish additional criteria for determining when employers may join together in a group or association of employers that will be treated as an employer under section 3(5) of such Act for purposes of sponsoring a group health plan, and for other purposes.",False,False,2019-04-12,Health,W000798,Tim Walberg,R,23,0,23,0
2021-02-26_00-55-20,hr,2295,116,PARSED,Hardest Hit Housing Act of 2019,"To provide additional funding for the public housing Capital Fund for large public housing agencies, for mortgage foreclosure mitigation assistance, and for incremental rental assistance vouchers, and for other purposes.",False,False,2019-04-12,Housing and Community Development,C001067,Yvette D. Clarke,D,4,4,0,0
2021-02-26_00-55-21,hr,2296,116,PARSED,More Efficient Tools to Realize Information for Consumers Act,"To require reporting regarding certain drug price increases, and for other purposes.",False,False,2019-04-12,Health,S001145,Jan Schakowsky,D,8,5,3,0
2021-02-26_00-55-22,hr,2297,116,PARSED,Tax Filing Simplification Act of 2019,To amend the Internal Revenue Code of 1986 to establish a free online tax preparation and filing service and programs that allow taxpayers to access third-party provided tax return information.,False,False,2019-04-12,Taxation,S000344,Brad Sherman,D,9,9,0,0
2021-02-26_00-55-22,hr,2298,116,PARSED,Repeated Objectionable Bothering Of Consumers On Phones Act,"To amend the Communications Act of 1934 to expand and clarify the prohibition on misleading or inaccurate caller identification information and to require providers of telephone service to offer technology to subscribers to reduce the incidence of unwanted telephone calls and text messages, and for other purposes.",False,False,2019-04-12,"Science, Technology, Communications",S001175,Jackie Speier,D,20,20,0,0
2021-02-26_00-55-23,hr,2299,116,PARSED,Multilateral Aid Review Act of 2019,To establish a review of United States multilateral aid.,False,False,2019-04-12,International Affairs,B001297,Ken Buck,R,1,0,1,0
2021-02-26_00-55-23,hr,2300,116,PARSED,Eliminating Debtor's Prison for Kids Act of 2019,"To establish a grant to provide mental health services and behavioral health services to at-risk youth, and for other purposes.",False,False,2019-04-12,Crime and Law Enforcement,C001097,Tony Cárdenas,D,30,30,0,0
2021-02-26_00-55-24,hr,2301,116,PARSED,Seniors Fraud Prevention Act of 2019,"To establish an advisory office within the Bureau of Consumer Protection of the Federal Trade Commission to prevent fraud targeting seniors, and for other purposes.",False,False,2019-04-12,Commerce,D000610,Ted Deutch,D,10,7,3,0
2021-02-26_00-55-25,hr,2302,116,PARSED,Protecting and Preserving Social Security Act,"To amend title II of the Social Security Act and the Internal Revenue Code of 1986 to make improvements in the old-age, survivors, and disability insurance program, and to provide for Social Security benefit protection.",False,False,2019-04-12,Social Welfare,D000610,Ted Deutch,D,8,8,0,0
2021-02-26_00-55-26,hr,2303,116,PARSED,Gladys Ricart Gun Offender Registry Act,"To establish a registration for violent gun offenders, to provide for sufficient notification of their whereabouts, to honor the memory of Gladys Ricart and other gun crime victims, and for other purposes.",False,False,2019-04-12,Crime and Law Enforcement,E000297,Adriano Espaillat,D,0,0,0,0
2021-02-26_00-55-26,hr,2304,116,PARSED,Autofill Act of 2019,To amend the Internal Revenue Code of 1986 to establish a program to populate downloadable tax forms with taxpayer return information.,False,False,2019-04-12,Taxation,F000454,Bill Foster,D,0,0,0,0
2021-02-26_00-55-27,hr,2305,116,PARSED,Veterans Members Business Loan Act,To amend the Federal Credit Union Act to exclude extensions of credit made to veterans from the definition of a member business loan.,False,False,2019-04-12,Finance and Financial Sector,G000581,Vicente Gonzalez,D,12,8,4,0
2021-02-26_00-55-28,hr,2306,116,PARSED,Puerto Rico Medicaid Act of 2019,"To amend titles XI and XIX of the Social Security Act to strengthen the Medicaid program in Puerto Rico, and for other purposes.",False,False,2019-04-12,Health,G000582,Jenniffer González-Colón,R,0,0,0,0
2021-02-26_00-55-28,hr,2307,116,PARSED,"To amend title 5, United States Code, to provide authority to the Administrator of the Drug Enforcement Administration to provide a cash award to Administration employees with foreign language skills, and for other purposes.","To amend title 5, United States Code, to provide authority to the Administrator of the Drug Enforcement Administration to provide a cash award to Administration employees with foreign language skills, and for other purposes.",False,False,2019-04-12,Government Operations and Politics,G000582,Jenniffer González-Colón,R,0,0,0,0
2021-02-26_00-55-29,hr,2308,116,PARSED,To amend the VA MISSION Act of 2018 to expand the veterans healing veterans medical access and scholarship program to include more students and schools.,To amend the VA MISSION Act of 2018 to expand the veterans healing veterans medical access and scholarship program to include more students and schools.,False,False,2019-04-12,Armed Forces and National Security,G000582,Jenniffer González-Colón,R,0,0,0,0
2021-02-26_00-55-29,hr,2309,116,PARSED,Real Estate Exchange Fairness Act of 2019,To amend the Internal Revenue Code of 1986 to treat Puerto Rico as part of the United States for purposes of determining whether real property qualifies for treatment as a like-kind exchange.,False,False,2019-04-12,Taxation,G000582,Jenniffer González-Colón,R,0,0,0,0
2021-02-26_00-55-30,hr,2310,116,PARSED,Fairness in Medicare Part B Enrollment Act of 2019,To amend title XVIII of the Social Security Act to eliminate late enrollment penalties under part B of the Medicare program for individuals residing in Puerto Rico if such individuals enroll within 5 years of becoming entitled to benefits under part A of such program.,False,False,2019-04-12,Health,G000582,Jenniffer González-Colón,R,0,0,0,0
2021-02-26_00-55-30,hr,2311,116,PARSED,Anti-Lunch Shaming Act of 2019,To amend the Richard B. Russell National School Lunch Act to prohibit the stigmatization of children who are unable to pay for meals.,False,False,2019-04-12,Agriculture and Food,H001080,Debra Haaland,D,95,88,7,0
2021-02-26_00-55-32,hr,2312,116,PARSED,Elder Pride Act,"To amend the Older Americans Act of 1965 to establish the Office of Inclusivity and Sexual Health and a rural outreach grant program carried out by that Office, and for other purposes.",False,False,2019-04-12,Social Welfare,H001080,Debra Haaland,D,15,15,0,0
2021-02-26_00-55-33,hr,2313,116,PARSED,Water Conservation Rebate Tax Parity Act,To amend the Internal Revenue Code of 1986 to expand the exclusion for certain conservation subsidies to include subsidies for water conservation or efficiency measures and storm water management measures.,False,False,2019-04-12,Taxation,H001068,Jared Huffman,D,21,19,2,0
2021-02-26_00-55-34,hr,2314,116,PARSED,Nuclear Powers America Act of 2019,To amend the Internal Revenue Code of 1986 to provide for an investment tax credit related to the production of electricity from nuclear energy.,False,False,2019-04-12,Taxation,L000585,Darin M. LaHood,R,42,15,27,0
2021-02-26_00-55-35,hr,2315,116,PARSED,Keep Our PACT Act,To require full funding of part A of title I of the Elementary and Secondary Education Act of 1965 and the Individuals with Disabilities Education Act.,False,False,2019-04-12,Education,L000590,Susie Lee,D,65,63,2,0
2021-02-26_00-55-37,hr,2316,116,PARSED,"To amend title XIX of the Social Security Act to require a Federal medical assistance percentage of 100 percent for urban Indian organizations, and for other purposes.","To amend title XIX of the Social Security Act to require a Federal medical assistance percentage of 100 percent for urban Indian organizations, and for other purposes.",False,False,2019-04-12,Native Americans,L000570,Ben Ray Luján,D,18,16,2,0
2021-02-26_00-55-37,hr,2317,116,PARSED,Peter J. McGuire Labor Day Landmark Act,"To designate the Peter J. McGuire Memorial and Peter J. McGuire Gravesite located in Pennsauken, New Jersey, as a National Historic Landmark, and for other purposes.",False,False,2019-04-12,Public Lands and Natural Resources,N000188,Donald W. Norcross,D,3,3,0,0
2021-02-26_00-55-38,hr,2318,116,PARSED,FIRM IT Act of 2019,"To amend the Biggert-Waters Flood Insurance Reform Act of 2012 to improve mapping under the National Flood Insurance Program, and for other purposes.",False,False,2019-04-12,Finance and Financial Sector,P000599,Bill Posey,R,0,0,0,0
2021-02-26_00-55-39,hr,2319,116,PARSED,21st Century NICS Act,To improve the national instant criminal background check system in order to search the National Data Exchange database when conducting criminal background checks.,False,False,2019-04-12,Crime and Law Enforcement,R000597,Tom Rice,R,37,3,34,0
2021-02-26_00-55-40,hr,2320,116,PARSED,Walter Patterson and Werner Foerster Justice and Extradition Act,To direct the President to submit to Congress a report on fugitives currently residing in other countries whose extradition is sought by the United States and related matters.,False,False,2019-04-12,International Affairs,S000522,Christopher H. Smith,R,1,1,0,0
2021-02-26_00-55-41,hr,2321,116,PARSED,Understanding the True Cost of College Act of 2019,"To require a standard financial aid offer form, and for other purposes.",False,False,2019-04-12,Education,V000133,Jefferson Van Drew,D,13,10,3,0
2021-02-26_00-55-42,hr,2322,116,PARSED,Accelerated Payments for Small Businesses Act of 2019,"To amend section 3903 of title 31, United States Code, to establish accelerated payments applicable to contracts with certain small business concerns, and for other purposes.",False,False,2019-04-15,Government Operations and Politics,B001306,Troy Balderson,R,18,8,10,0
2021-02-26_00-55-43,hr,2323,116,PARSED,Spousal Membership for Veterans Organizations Act of 2019,"To amend the Internal Revenue Code of 1986 to allow certain veterans organizations to take into account the membership of spouses, widows, and widowers of members of the Armed Forces for purposes of determining tax exempt status.",False,False,2019-04-15,Taxation,E000215,Anna G. Eshoo,D,0,0,0,0
